{
  "schema": "frank.data-route/v1",
  "decisionId": "route-2026-07-28-0001",
  "cellId": "cell-steven-primary",
  "effectiveClass": "private",
  "contributingSources": [
    {
      "sourceId": "src-email-thread-8842",
      "class": "private",
      "trust": "external-untrusted"
    },
    {
      "sourceId": "src-note-daily-2026-07-28",
      "class": "internal",
      "trust": "owner-authenticated"
    }
  ],
  "processor": {
    "kind": "model",
    "id": "model.broker/alias:reasoning-standard"
  },
  "processingLocation": {
    "mode": "hosted-approved",
    "region": "eu-west-1"
  },
  "retention": {
    "retainedForDays": 0,
    "usedForTraining": false,
    "termsVersion": "provider-terms-2026-05-01"
  },
  "redactions": [],
  "policyVersion": "data-route-policy/2026.07.1",
  "reason": "Strictest contributing class is private; promotional pools and training-retaining processors are excluded for private data (FRANK-§2.3).",
  "decidedAt": "2026-07-28T09:14:03.221Z"
}
